No.     Time           Source                Destination           Protocol Length Info
   1239 15.679028786   2001:660:6602:142::10 2001:660:6602:102::5  TCP      94     42260 → 1883 [SYN] Seq=0 Win=28800 Len=0 MSS=1440 SACK_PERM=1 TSval=906337 TSecr=0 WS=128

Frame 1239: 94 bytes on wire (752 bits), 94 bytes captured (752 bits) on interface 0
    Interface id: 0 (eth1)
    Encapsulation type: Ethernet (1)
    Arrival Time: May 19, 2017 10:36:44.567685531 CEST
    [Time shift for this packet: 0.000000000 seconds]
    Epoch Time: 1495183004.567685531 seconds
    [Time delta from previous captured frame: 0.000658852 seconds]
    [Time delta from previous displayed frame: 0.000000000 seconds]
    [Time since reference or first frame: 15.679028786 seconds]
    Frame Number: 1239
    Frame Length: 94 bytes (752 bits)
    Capture Length: 94 bytes (752 bits)
    [Frame is marked: False]
    [Frame is ignored: False]
    [Protocols in frame: eth:ethertype:ipv6:tcp]
    [Coloring Rule Name: TCP SYN/FIN]
    [Coloring Rule String: tcp.flags & 0x02 || tcp.flags.fin == 1]
Ethernet II, Src: PcsCompu_48:f0:a3 (08:00:27:48:f0:a3), Dst: PcsCompu_4d:e8:0a (08:00:27:4d:e8:0a)
Internet Protocol Version 6, Src: 2001:660:6602:142::10, Dst: 2001:660:6602:102::5
Transmission Control Protocol, Src Port: 42260, Dst Port: 1883, Seq: 0, Len: 0

No.     Time           Source                Destination           Protocol Length Info
   1240 15.679082962   2001:660:6602:102::5  2001:660:6602:142::10 TCP      94     1883 → 42260 [SYN, ACK] Seq=0 Ack=1 Win=28560 Len=0 MSS=1440 SACK_PERM=1 TSval=906217 TSecr=906337 WS=128

Frame 1240: 94 bytes on wire (752 bits), 94 bytes captured (752 bits) on interface 0
    Interface id: 0 (eth1)
    Encapsulation type: Ethernet (1)
    Arrival Time: May 19, 2017 10:36:44.567739707 CEST
    [Time shift for this packet: 0.000000000 seconds]
    Epoch Time: 1495183004.567739707 seconds
    [Time delta from previous captured frame: 0.000054176 seconds]
    [Time delta from previous displayed frame: 0.000054176 seconds]
    [Time since reference or first frame: 15.679082962 seconds]
    Frame Number: 1240
    Frame Length: 94 bytes (752 bits)
    Capture Length: 94 bytes (752 bits)
    [Frame is marked: False]
    [Frame is ignored: False]
    [Protocols in frame: eth:ethertype:ipv6:tcp]
    [Coloring Rule Name: TCP SYN/FIN]
    [Coloring Rule String: tcp.flags & 0x02 || tcp.flags.fin == 1]
Ethernet II, Src: PcsCompu_4d:e8:0a (08:00:27:4d:e8:0a), Dst: PcsCompu_48:f0:a3 (08:00:27:48:f0:a3)
Internet Protocol Version 6, Src: 2001:660:6602:102::5, Dst: 2001:660:6602:142::10
Transmission Control Protocol, Src Port: 1883, Dst Port: 42260, Seq: 0, Ack: 1, Len: 0

No.     Time           Source                Destination           Protocol Length Info
   1286 16.229133262   2001:660:6602:142::10 2001:660:6602:102::5  TCP      86     42260 → 1883 [ACK] Seq=1 Ack=1 Win=28800 Len=0 TSval=906475 TSecr=906217

Frame 1286: 86 bytes on wire (688 bits), 86 bytes captured (688 bits) on interface 0
    Interface id: 0 (eth1)
    Encapsulation type: Ethernet (1)
    Arrival Time: May 19, 2017 10:36:45.117790007 CEST
    [Time shift for this packet: 0.000000000 seconds]
    Epoch Time: 1495183005.117790007 seconds
    [Time delta from previous captured frame: 0.000203009 seconds]
    [Time delta from previous displayed frame: 0.550050300 seconds]
    [Time since reference or first frame: 16.229133262 seconds]
    Frame Number: 1286
    Frame Length: 86 bytes (688 bits)
    Capture Length: 86 bytes (688 bits)
    [Frame is marked: False]
    [Frame is ignored: False]
    [Protocols in frame: eth:ethertype:ipv6:tcp]
    [Coloring Rule Name: TCP]
    [Coloring Rule String: tcp]
Ethernet II, Src: PcsCompu_48:f0:a3 (08:00:27:48:f0:a3), Dst: PcsCompu_4d:e8:0a (08:00:27:4d:e8:0a)
Internet Protocol Version 6, Src: 2001:660:6602:142::10, Dst: 2001:660:6602:102::5
Transmission Control Protocol, Src Port: 42260, Dst Port: 1883, Seq: 1, Ack: 1, Len: 0

No.     Time           Source                Destination           Protocol Length Info
   1287 16.229173625   2001:660:6602:142::10 2001:660:6602:102::5  MQTT     124    Connect Command

Frame 1287: 124 bytes on wire (992 bits), 124 bytes captured (992 bits) on interface 0
    Interface id: 0 (eth1)
    Encapsulation type: Ethernet (1)
    Arrival Time: May 19, 2017 10:36:45.117830370 CEST
    [Time shift for this packet: 0.000000000 seconds]
    Epoch Time: 1495183005.117830370 seconds
    [Time delta from previous captured frame: 0.000040363 seconds]
    [Time delta from previous displayed frame: 0.000040363 seconds]
    [Time since reference or first frame: 16.229173625 seconds]
    Frame Number: 1287
    Frame Length: 124 bytes (992 bits)
    Capture Length: 124 bytes (992 bits)
    [Frame is marked: False]
    [Frame is ignored: False]
    [Protocols in frame: eth:ethertype:ipv6:tcp:mqtt]
    [Coloring Rule Name: TCP]
    [Coloring Rule String: tcp]
Ethernet II, Src: PcsCompu_48:f0:a3 (08:00:27:48:f0:a3), Dst: PcsCompu_4d:e8:0a (08:00:27:4d:e8:0a)
Internet Protocol Version 6, Src: 2001:660:6602:142::10, Dst: 2001:660:6602:102::5
Transmission Control Protocol, Src Port: 42260, Dst Port: 1883, Seq: 1, Ack: 1, Len: 38
MQ Telemetry Transport Protocol
    Connect Command
        0001 0000 = Header Flags: 0x10 (Connect Command)
        Msg Len: 36
        Protocol Name: MQIsdp
        Version: 3
        0000 0010 = Connect Flags: 0x02
        Keep Alive: 60
        Client ID: mosq_sub_2728_nico14-V

No.     Time           Source                Destination           Protocol Length Info
   1288 16.229184663   2001:660:6602:102::5  2001:660:6602:142::10 TCP      86     1883 → 42260 [ACK] Seq=1 Ack=39 Win=28672 Len=0 TSval=906354 TSecr=906476

Frame 1288: 86 bytes on wire (688 bits), 86 bytes captured (688 bits) on interface 0
    Interface id: 0 (eth1)
    Encapsulation type: Ethernet (1)
    Arrival Time: May 19, 2017 10:36:45.117841408 CEST
    [Time shift for this packet: 0.000000000 seconds]
    Epoch Time: 1495183005.117841408 seconds
    [Time delta from previous captured frame: 0.000011038 seconds]
    [Time delta from previous displayed frame: 0.000011038 seconds]
    [Time since reference or first frame: 16.229184663 seconds]
    Frame Number: 1288
    Frame Length: 86 bytes (688 bits)
    Capture Length: 86 bytes (688 bits)
    [Frame is marked: False]
    [Frame is ignored: False]
    [Protocols in frame: eth:ethertype:ipv6:tcp]
    [Coloring Rule Name: TCP]
    [Coloring Rule String: tcp]
Ethernet II, Src: PcsCompu_4d:e8:0a (08:00:27:4d:e8:0a), Dst: PcsCompu_48:f0:a3 (08:00:27:48:f0:a3)
Internet Protocol Version 6, Src: 2001:660:6602:102::5, Dst: 2001:660:6602:142::10
Transmission Control Protocol, Src Port: 1883, Dst Port: 42260, Seq: 1, Ack: 39, Len: 0

No.     Time           Source                Destination           Protocol Length Info
   1289 16.229368984   2001:660:6602:102::5  2001:660:6602:142::10 MQTT     90     Connect Ack

Frame 1289: 90 bytes on wire (720 bits), 90 bytes captured (720 bits) on interface 0
    Interface id: 0 (eth1)
    Encapsulation type: Ethernet (1)
    Arrival Time: May 19, 2017 10:36:45.118025729 CEST
    [Time shift for this packet: 0.000000000 seconds]
    Epoch Time: 1495183005.118025729 seconds
    [Time delta from previous captured frame: 0.000184321 seconds]
    [Time delta from previous displayed frame: 0.000184321 seconds]
    [Time since reference or first frame: 16.229368984 seconds]
    Frame Number: 1289
    Frame Length: 90 bytes (720 bits)
    Capture Length: 90 bytes (720 bits)
    [Frame is marked: False]
    [Frame is ignored: False]
    [Protocols in frame: eth:ethertype:ipv6:tcp:mqtt]
    [Coloring Rule Name: TCP]
    [Coloring Rule String: tcp]
Ethernet II, Src: PcsCompu_4d:e8:0a (08:00:27:4d:e8:0a), Dst: PcsCompu_48:f0:a3 (08:00:27:48:f0:a3)
Internet Protocol Version 6, Src: 2001:660:6602:102::5, Dst: 2001:660:6602:142::10
Transmission Control Protocol, Src Port: 1883, Dst Port: 42260, Seq: 1, Ack: 39, Len: 4
MQ Telemetry Transport Protocol
    Connect Ack
        0010 0000 = Header Flags: 0x20 (Connect Ack)
        Msg Len: 2
        .... .... 0000 0000 = Connection Ack: Connection Accepted (0)

No.     Time           Source                Destination           Protocol Length Info
   1335 16.783760926   2001:660:6602:142::10 2001:660:6602:102::5  TCP      86     42260 → 1883 [ACK] Seq=39 Ack=5 Win=28800 Len=0 TSval=906615 TSecr=906354

Frame 1335: 86 bytes on wire (688 bits), 86 bytes captured (688 bits) on interface 0
    Interface id: 0 (eth1)
    Encapsulation type: Ethernet (1)
    Arrival Time: May 19, 2017 10:36:45.672417671 CEST
    [Time shift for this packet: 0.000000000 seconds]
    Epoch Time: 1495183005.672417671 seconds
    [Time delta from previous captured frame: 0.000470449 seconds]
    [Time delta from previous displayed frame: 0.554391942 seconds]
    [Time since reference or first frame: 16.783760926 seconds]
    Frame Number: 1335
    Frame Length: 86 bytes (688 bits)
    Capture Length: 86 bytes (688 bits)
    [Frame is marked: False]
    [Frame is ignored: False]
    [Protocols in frame: eth:ethertype:ipv6:tcp]
    [Coloring Rule Name: TCP]
    [Coloring Rule String: tcp]
Ethernet II, Src: PcsCompu_48:f0:a3 (08:00:27:48:f0:a3), Dst: PcsCompu_4d:e8:0a (08:00:27:4d:e8:0a)
Internet Protocol Version 6, Src: 2001:660:6602:142::10, Dst: 2001:660:6602:102::5
Transmission Control Protocol, Src Port: 42260, Dst Port: 1883, Seq: 39, Ack: 5, Len: 0

No.     Time           Source                Destination           Protocol Length Info
   1336 16.783781862   2001:660:6602:142::10 2001:660:6602:102::5  MQTT     98     Subscribe Request

Frame 1336: 98 bytes on wire (784 bits), 98 bytes captured (784 bits) on interface 0
    Interface id: 0 (eth1)
    Encapsulation type: Ethernet (1)
    Arrival Time: May 19, 2017 10:36:45.672438607 CEST
    [Time shift for this packet: 0.000000000 seconds]
    Epoch Time: 1495183005.672438607 seconds
    [Time delta from previous captured frame: 0.000020936 seconds]
    [Time delta from previous displayed frame: 0.000020936 seconds]
    [Time since reference or first frame: 16.783781862 seconds]
    Frame Number: 1336
    Frame Length: 98 bytes (784 bits)
    Capture Length: 98 bytes (784 bits)
    [Frame is marked: False]
    [Frame is ignored: False]
    [Protocols in frame: eth:ethertype:ipv6:tcp:mqtt]
    [Coloring Rule Name: TCP]
    [Coloring Rule String: tcp]
Ethernet II, Src: PcsCompu_48:f0:a3 (08:00:27:48:f0:a3), Dst: PcsCompu_4d:e8:0a (08:00:27:4d:e8:0a)
Internet Protocol Version 6, Src: 2001:660:6602:142::10, Dst: 2001:660:6602:102::5
Transmission Control Protocol, Src Port: 42260, Dst Port: 1883, Seq: 39, Ack: 5, Len: 12
MQ Telemetry Transport Protocol
    Subscribe Request
        1000 0010 = Header Flags: 0x82 (Subscribe Request)
        Msg Len: 10
        Message Identifier: 1
        Topic: topic
        .... ..01 = Granted Qos: Acknowledged deliver (1)

No.     Time           Source                Destination           Protocol Length Info
   1337 16.783868538   2001:660:6602:102::5  2001:660:6602:142::10 MQTT     91     Subscribe Ack

Frame 1337: 91 bytes on wire (728 bits), 91 bytes captured (728 bits) on interface 0
    Interface id: 0 (eth1)
    Encapsulation type: Ethernet (1)
    Arrival Time: May 19, 2017 10:36:45.672525283 CEST
    [Time shift for this packet: 0.000000000 seconds]
    Epoch Time: 1495183005.672525283 seconds
    [Time delta from previous captured frame: 0.000086676 seconds]
    [Time delta from previous displayed frame: 0.000086676 seconds]
    [Time since reference or first frame: 16.783868538 seconds]
    Frame Number: 1337
    Frame Length: 91 bytes (728 bits)
    Capture Length: 91 bytes (728 bits)
    [Frame is marked: False]
    [Frame is ignored: False]
    [Protocols in frame: eth:ethertype:ipv6:tcp:mqtt]
    [Coloring Rule Name: TCP]
    [Coloring Rule String: tcp]
Ethernet II, Src: PcsCompu_4d:e8:0a (08:00:27:4d:e8:0a), Dst: PcsCompu_48:f0:a3 (08:00:27:48:f0:a3)
Internet Protocol Version 6, Src: 2001:660:6602:102::5, Dst: 2001:660:6602:142::10
Transmission Control Protocol, Src Port: 1883, Dst Port: 42260, Seq: 5, Ack: 51, Len: 5
MQ Telemetry Transport Protocol
    Subscribe Ack
        1001 0000 = Header Flags: 0x90 (Subscribe Ack)
        Msg Len: 3
        Message Identifier: 1
        .... ..01 = Granted Qos: Acknowledged deliver (1)

No.     Time           Source                Destination           Protocol Length Info
   1387 17.374082046   2001:660:6602:142::10 2001:660:6602:102::5  TCP      86     42260 → 1883 [ACK] Seq=51 Ack=10 Win=28800 Len=0 TSval=906763 TSecr=906493

Frame 1387: 86 bytes on wire (688 bits), 86 bytes captured (688 bits) on interface 0
    Interface id: 0 (eth1)
    Encapsulation type: Ethernet (1)
    Arrival Time: May 19, 2017 10:36:46.262738791 CEST
    [Time shift for this packet: 0.000000000 seconds]
    Epoch Time: 1495183006.262738791 seconds
    [Time delta from previous captured frame: 0.000385361 seconds]
    [Time delta from previous displayed frame: 0.590213508 seconds]
    [Time since reference or first frame: 17.374082046 seconds]
    Frame Number: 1387
    Frame Length: 86 bytes (688 bits)
    Capture Length: 86 bytes (688 bits)
    [Frame is marked: False]
    [Frame is ignored: False]
    [Protocols in frame: eth:ethertype:ipv6:tcp]
    [Coloring Rule Name: TCP]
    [Coloring Rule String: tcp]
Ethernet II, Src: PcsCompu_48:f0:a3 (08:00:27:48:f0:a3), Dst: PcsCompu_4d:e8:0a (08:00:27:4d:e8:0a)
Internet Protocol Version 6, Src: 2001:660:6602:142::10, Dst: 2001:660:6602:102::5
Transmission Control Protocol, Src Port: 42260, Dst Port: 1883, Seq: 51, Ack: 10, Len: 0

No.     Time           Source                Destination           Protocol Length Info
   1624 20.348174696   2001:660:6602:102::5  2001:660:6602:142::10 MQTT     196    Publish Message

Frame 1624: 196 bytes on wire (1568 bits), 196 bytes captured (1568 bits) on interface 0
    Interface id: 0 (eth1)
    Encapsulation type: Ethernet (1)
    Arrival Time: May 19, 2017 10:36:49.236831441 CEST
    [Time shift for this packet: 0.000000000 seconds]
    Epoch Time: 1495183009.236831441 seconds
    [Time delta from previous captured frame: 0.003449817 seconds]
    [Time delta from previous displayed frame: 2.974092650 seconds]
    [Time since reference or first frame: 20.348174696 seconds]
    Frame Number: 1624
    Frame Length: 196 bytes (1568 bits)
    Capture Length: 196 bytes (1568 bits)
    [Frame is marked: False]
    [Frame is ignored: False]
    [Protocols in frame: eth:ethertype:ipv6:tcp:mqtt]
    [Coloring Rule Name: TCP]
    [Coloring Rule String: tcp]
Ethernet II, Src: PcsCompu_4d:e8:0a (08:00:27:4d:e8:0a), Dst: PcsCompu_48:f0:a3 (08:00:27:48:f0:a3)
Internet Protocol Version 6, Src: 2001:660:6602:102::5, Dst: 2001:660:6602:142::10
Transmission Control Protocol, Src Port: 1883, Dst Port: 42260, Seq: 10, Ack: 51, Len: 110
MQ Telemetry Transport Protocol
    Publish Message
        0011 0010 = Header Flags: 0x32 (Publish Message)
        Msg Len: 108
        Topic: topic
        Message Identifier: 1
        Message: xxxxxxxxxxxxxxxxxxxxxxxxxxxxxxxxxxxxxxxxxxxxxxxxxxxxxxxxxxxxxxxxxxxxxxxxxxxxxxxxxxxxxxxxxxxxxxxxx 1

No.     Time           Source                Destination           Protocol Length Info
   1712 21.461886446   2001:660:6602:102::5  2001:660:6602:142::10 TCP      196    [TCP Retransmission] 1883 → 42260 [PSH, ACK] Seq=10 Ack=51 Win=28672 Len=110 TSval=907663 TSecr=906763

Frame 1712: 196 bytes on wire (1568 bits), 196 bytes captured (1568 bits) on interface 0
    Interface id: 0 (eth1)
    Encapsulation type: Ethernet (1)
    Arrival Time: May 19, 2017 10:36:50.350543191 CEST
    [Time shift for this packet: 0.000000000 seconds]
    Epoch Time: 1495183010.350543191 seconds
    [Time delta from previous captured frame: 0.016452719 seconds]
    [Time delta from previous displayed frame: 1.113711750 seconds]
    [Time since reference or first frame: 21.461886446 seconds]
    Frame Number: 1712
    Frame Length: 196 bytes (1568 bits)
    Capture Length: 196 bytes (1568 bits)
    [Frame is marked: False]
    [Frame is ignored: False]
    [Protocols in frame: eth:ethertype:ipv6:tcp]
    [Coloring Rule Name: Bad TCP]
    [Coloring Rule String: tcp.analysis.flags && !tcp.analysis.window_update]
Ethernet II, Src: PcsCompu_4d:e8:0a (08:00:27:4d:e8:0a), Dst: PcsCompu_48:f0:a3 (08:00:27:48:f0:a3)
Internet Protocol Version 6, Src: 2001:660:6602:102::5, Dst: 2001:660:6602:142::10
Transmission Control Protocol, Src Port: 1883, Dst Port: 42260, Seq: 10, Ack: 51, Len: 110

No.     Time           Source                Destination           Protocol Length Info
   1833 23.013978018   2001:660:6602:102::5  2001:660:6602:142::10 TCP      196    [TCP Retransmission] 1883 → 42260 [PSH, ACK] Seq=10 Ack=51 Win=28672 Len=110 TSval=908051 TSecr=906763

Frame 1833: 196 bytes on wire (1568 bits), 196 bytes captured (1568 bits) on interface 0
    Interface id: 0 (eth1)
    Encapsulation type: Ethernet (1)
    Arrival Time: May 19, 2017 10:36:51.902634763 CEST
    [Time shift for this packet: 0.000000000 seconds]
    Epoch Time: 1495183011.902634763 seconds
    [Time delta from previous captured frame: 0.011772863 seconds]
    [Time delta from previous displayed frame: 1.552091572 seconds]
    [Time since reference or first frame: 23.013978018 seconds]
    Frame Number: 1833
    Frame Length: 196 bytes (1568 bits)
    Capture Length: 196 bytes (1568 bits)
    [Frame is marked: False]
    [Frame is ignored: False]
    [Protocols in frame: eth:ethertype:ipv6:tcp]
    [Coloring Rule Name: Bad TCP]
    [Coloring Rule String: tcp.analysis.flags && !tcp.analysis.window_update]
Ethernet II, Src: PcsCompu_4d:e8:0a (08:00:27:4d:e8:0a), Dst: PcsCompu_48:f0:a3 (08:00:27:48:f0:a3)
Internet Protocol Version 6, Src: 2001:660:6602:102::5, Dst: 2001:660:6602:142::10
Transmission Control Protocol, Src Port: 1883, Dst Port: 42260, Seq: 10, Ack: 51, Len: 110

No.     Time           Source                Destination           Protocol Length Info
   2077 26.121956972   2001:660:6602:102::5  2001:660:6602:142::10 TCP      196    [TCP Retransmission] 1883 → 42260 [PSH, ACK] Seq=10 Ack=51 Win=28672 Len=110 TSval=908828 TSecr=906763

Frame 2077: 196 bytes on wire (1568 bits), 196 bytes captured (1568 bits) on interface 0
    Interface id: 0 (eth1)
    Encapsulation type: Ethernet (1)
    Arrival Time: May 19, 2017 10:36:55.010613717 CEST
    [Time shift for this packet: 0.000000000 seconds]
    Epoch Time: 1495183015.010613717 seconds
    [Time delta from previous captured frame: 0.007906382 seconds]
    [Time delta from previous displayed frame: 3.107978954 seconds]
    [Time since reference or first frame: 26.121956972 seconds]
    Frame Number: 2077
    Frame Length: 196 bytes (1568 bits)
    Capture Length: 196 bytes (1568 bits)
    [Frame is marked: False]
    [Frame is ignored: False]
    [Protocols in frame: eth:ethertype:ipv6:tcp]
    [Coloring Rule Name: Bad TCP]
    [Coloring Rule String: tcp.analysis.flags && !tcp.analysis.window_update]
Ethernet II, Src: PcsCompu_4d:e8:0a (08:00:27:4d:e8:0a), Dst: PcsCompu_48:f0:a3 (08:00:27:48:f0:a3)
Internet Protocol Version 6, Src: 2001:660:6602:102::5, Dst: 2001:660:6602:142::10
Transmission Control Protocol, Src Port: 1883, Dst Port: 42260, Seq: 10, Ack: 51, Len: 110

No.     Time           Source                Destination           Protocol Length Info
   2568 32.329953566   2001:660:6602:102::5  2001:660:6602:142::10 TCP      196    [TCP Retransmission] 1883 → 42260 [PSH, ACK] Seq=10 Ack=51 Win=28672 Len=110 TSval=910380 TSecr=906763

Frame 2568: 196 bytes on wire (1568 bits), 196 bytes captured (1568 bits) on interface 0
    Interface id: 0 (eth1)
    Encapsulation type: Ethernet (1)
    Arrival Time: May 19, 2017 10:37:01.218610311 CEST
    [Time shift for this packet: 0.000000000 seconds]
    Epoch Time: 1495183021.218610311 seconds
    [Time delta from previous captured frame: 0.012975334 seconds]
    [Time delta from previous displayed frame: 6.207996594 seconds]
    [Time since reference or first frame: 32.329953566 seconds]
    Frame Number: 2568
    Frame Length: 196 bytes (1568 bits)
    Capture Length: 196 bytes (1568 bits)
    [Frame is marked: False]
    [Frame is ignored: False]
    [Protocols in frame: eth:ethertype:ipv6:tcp]
    [Coloring Rule Name: Bad TCP]
    [Coloring Rule String: tcp.analysis.flags && !tcp.analysis.window_update]
Ethernet II, Src: PcsCompu_4d:e8:0a (08:00:27:4d:e8:0a), Dst: PcsCompu_48:f0:a3 (08:00:27:48:f0:a3)
Internet Protocol Version 6, Src: 2001:660:6602:102::5, Dst: 2001:660:6602:142::10
Transmission Control Protocol, Src Port: 1883, Dst Port: 42260, Seq: 10, Ack: 51, Len: 110

No.     Time           Source                Destination           Protocol Length Info
   2613 32.873452472   2001:660:6602:142::10 2001:660:6602:102::5  TCP      86     42260 → 1883 [ACK] Seq=51 Ack=120 Win=28800 Len=0 TSval=910639 TSecr=910380

Frame 2613: 86 bytes on wire (688 bits), 86 bytes captured (688 bits) on interface 0
    Interface id: 0 (eth1)
    Encapsulation type: Ethernet (1)
    Arrival Time: May 19, 2017 10:37:01.762109217 CEST
    [Time shift for this packet: 0.000000000 seconds]
    Epoch Time: 1495183021.762109217 seconds
    [Time delta from previous captured frame: 0.000419228 seconds]
    [Time delta from previous displayed frame: 0.543498906 seconds]
    [Time since reference or first frame: 32.873452472 seconds]
    Frame Number: 2613
    Frame Length: 86 bytes (688 bits)
    Capture Length: 86 bytes (688 bits)
    [Frame is marked: False]
    [Frame is ignored: False]
    [Protocols in frame: eth:ethertype:ipv6:tcp]
    [Coloring Rule Name: TCP]
    [Coloring Rule String: tcp]
Ethernet II, Src: PcsCompu_48:f0:a3 (08:00:27:48:f0:a3), Dst: PcsCompu_4d:e8:0a (08:00:27:4d:e8:0a)
Internet Protocol Version 6, Src: 2001:660:6602:142::10, Dst: 2001:660:6602:102::5
Transmission Control Protocol, Src Port: 42260, Dst Port: 1883, Seq: 51, Ack: 120, Len: 0

No.     Time           Source                Destination           Protocol Length Info
   2614 32.873473236   2001:660:6602:142::10 2001:660:6602:102::5  MQTT     90     Publish Ack

Frame 2614: 90 bytes on wire (720 bits), 90 bytes captured (720 bits) on interface 0
    Interface id: 0 (eth1)
    Encapsulation type: Ethernet (1)
    Arrival Time: May 19, 2017 10:37:01.762129981 CEST
    [Time shift for this packet: 0.000000000 seconds]
    Epoch Time: 1495183021.762129981 seconds
    [Time delta from previous captured frame: 0.000020764 seconds]
    [Time delta from previous displayed frame: 0.000020764 seconds]
    [Time since reference or first frame: 32.873473236 seconds]
    Frame Number: 2614
    Frame Length: 90 bytes (720 bits)
    Capture Length: 90 bytes (720 bits)
    [Frame is marked: False]
    [Frame is ignored: False]
    [Protocols in frame: eth:ethertype:ipv6:tcp:mqtt]
    [Coloring Rule Name: TCP]
    [Coloring Rule String: tcp]
Ethernet II, Src: PcsCompu_48:f0:a3 (08:00:27:48:f0:a3), Dst: PcsCompu_4d:e8:0a (08:00:27:4d:e8:0a)
Internet Protocol Version 6, Src: 2001:660:6602:142::10, Dst: 2001:660:6602:102::5
Transmission Control Protocol, Src Port: 42260, Dst Port: 1883, Seq: 51, Ack: 120, Len: 4
MQ Telemetry Transport Protocol
    Publish Ack
        0100 0000 = Header Flags: 0x40 (Publish Ack)
        Msg Len: 2
        Message Identifier: 1

No.     Time           Source                Destination           Protocol Length Info
   2615 32.873575662   2001:660:6602:102::5  2001:660:6602:142::10 MQTT     196    Publish Message

Frame 2615: 196 bytes on wire (1568 bits), 196 bytes captured (1568 bits) on interface 0
    Interface id: 0 (eth1)
    Encapsulation type: Ethernet (1)
    Arrival Time: May 19, 2017 10:37:01.762232407 CEST
    [Time shift for this packet: 0.000000000 seconds]
    Epoch Time: 1495183021.762232407 seconds
    [Time delta from previous captured frame: 0.000102426 seconds]
    [Time delta from previous displayed frame: 0.000102426 seconds]
    [Time since reference or first frame: 32.873575662 seconds]
    Frame Number: 2615
    Frame Length: 196 bytes (1568 bits)
    Capture Length: 196 bytes (1568 bits)
    [Frame is marked: False]
    [Frame is ignored: False]
    [Protocols in frame: eth:ethertype:ipv6:tcp:mqtt]
    [Coloring Rule Name: TCP]
    [Coloring Rule String: tcp]
Ethernet II, Src: PcsCompu_4d:e8:0a (08:00:27:4d:e8:0a), Dst: PcsCompu_48:f0:a3 (08:00:27:48:f0:a3)
Internet Protocol Version 6, Src: 2001:660:6602:102::5, Dst: 2001:660:6602:142::10
Transmission Control Protocol, Src Port: 1883, Dst Port: 42260, Seq: 120, Ack: 55, Len: 110
MQ Telemetry Transport Protocol
    Publish Message
        0011 0010 = Header Flags: 0x32 (Publish Message)
        Msg Len: 108
        Topic: topic
        Message Identifier: 2
        Message: xxxxxxxxxxxxxxxxxxxxxxxxxxxxxxxxxxxxxxxxxxxxxxxxxxxxxxxxxxxxxxxxxxxxxxxxxxxxxxxxxxxxxxxxxxxxxxxxx 2

No.     Time           Source                Destination           Protocol Length Info
   2664 33.446342973   2001:660:6602:142::10 2001:660:6602:102::5  MQTT     90     Publish Ack

Frame 2664: 90 bytes on wire (720 bits), 90 bytes captured (720 bits) on interface 0
    Interface id: 0 (eth1)
    Encapsulation type: Ethernet (1)
    Arrival Time: May 19, 2017 10:37:02.334999718 CEST
    [Time shift for this packet: 0.000000000 seconds]
    Epoch Time: 1495183022.334999718 seconds
    [Time delta from previous captured frame: 0.000005321 seconds]
    [Time delta from previous displayed frame: 0.572767311 seconds]
    [Time since reference or first frame: 33.446342973 seconds]
    Frame Number: 2664
    Frame Length: 90 bytes (720 bits)
    Capture Length: 90 bytes (720 bits)
    [Frame is marked: False]
    [Frame is ignored: False]
    [Protocols in frame: eth:ethertype:ipv6:tcp:mqtt]
    [Coloring Rule Name: TCP]
    [Coloring Rule String: tcp]
Ethernet II, Src: PcsCompu_48:f0:a3 (08:00:27:48:f0:a3), Dst: PcsCompu_4d:e8:0a (08:00:27:4d:e8:0a)
Internet Protocol Version 6, Src: 2001:660:6602:142::10, Dst: 2001:660:6602:102::5
Transmission Control Protocol, Src Port: 42260, Dst Port: 1883, Seq: 55, Ack: 230, Len: 4
MQ Telemetry Transport Protocol
    Publish Ack
        0100 0000 = Header Flags: 0x40 (Publish Ack)
        Msg Len: 2
        Message Identifier: 2

No.     Time           Source                Destination           Protocol Length Info
   2665 33.446478142   2001:660:6602:102::5  2001:660:6602:142::10 MQTT     196    Publish Message

Frame 2665: 196 bytes on wire (1568 bits), 196 bytes captured (1568 bits) on interface 0
    Interface id: 0 (eth1)
    Encapsulation type: Ethernet (1)
    Arrival Time: May 19, 2017 10:37:02.335134887 CEST
    [Time shift for this packet: 0.000000000 seconds]
    Epoch Time: 1495183022.335134887 seconds
    [Time delta from previous captured frame: 0.000135169 seconds]
    [Time delta from previous displayed frame: 0.000135169 seconds]
    [Time since reference or first frame: 33.446478142 seconds]
    Frame Number: 2665
    Frame Length: 196 bytes (1568 bits)
    Capture Length: 196 bytes (1568 bits)
    [Frame is marked: False]
    [Frame is ignored: False]
    [Protocols in frame: eth:ethertype:ipv6:tcp:mqtt]
    [Coloring Rule Name: TCP]
    [Coloring Rule String: tcp]
Ethernet II, Src: PcsCompu_4d:e8:0a (08:00:27:4d:e8:0a), Dst: PcsCompu_48:f0:a3 (08:00:27:48:f0:a3)
Internet Protocol Version 6, Src: 2001:660:6602:102::5, Dst: 2001:660:6602:142::10
Transmission Control Protocol, Src Port: 1883, Dst Port: 42260, Seq: 230, Ack: 59, Len: 110
MQ Telemetry Transport Protocol
    Publish Message
        0011 0010 = Header Flags: 0x32 (Publish Message)
        Msg Len: 108
        Topic: topic
        Message Identifier: 3
        Message: xxxxxxxxxxxxxxxxxxxxxxxxxxxxxxxxxxxxxxxxxxxxxxxxxxxxxxxxxxxxxxxxxxxxxxxxxxxxxxxxxxxxxxxxxxxxxxxxx 3

No.     Time           Source                Destination           Protocol Length Info
   2712 33.999754331   2001:660:6602:142::10 2001:660:6602:102::5  MQTT     90     Publish Ack

Frame 2712: 90 bytes on wire (720 bits), 90 bytes captured (720 bits) on interface 0
    Interface id: 0 (eth1)
    Encapsulation type: Ethernet (1)
    Arrival Time: May 19, 2017 10:37:02.888411076 CEST
    [Time shift for this packet: 0.000000000 seconds]
    Epoch Time: 1495183022.888411076 seconds
    [Time delta from previous captured frame: 0.000338494 seconds]
    [Time delta from previous displayed frame: 0.553276189 seconds]
    [Time since reference or first frame: 33.999754331 seconds]
    Frame Number: 2712
    Frame Length: 90 bytes (720 bits)
    Capture Length: 90 bytes (720 bits)
    [Frame is marked: False]
    [Frame is ignored: False]
    [Protocols in frame: eth:ethertype:ipv6:tcp:mqtt]
    [Coloring Rule Name: TCP]
    [Coloring Rule String: tcp]
Ethernet II, Src: PcsCompu_48:f0:a3 (08:00:27:48:f0:a3), Dst: PcsCompu_4d:e8:0a (08:00:27:4d:e8:0a)
Internet Protocol Version 6, Src: 2001:660:6602:142::10, Dst: 2001:660:6602:102::5
Transmission Control Protocol, Src Port: 42260, Dst Port: 1883, Seq: 59, Ack: 340, Len: 4
MQ Telemetry Transport Protocol
    Publish Ack
        0100 0000 = Header Flags: 0x40 (Publish Ack)
        Msg Len: 2
        Message Identifier: 3

No.     Time           Source                Destination           Protocol Length Info
   2713 33.999862504   2001:660:6602:102::5  2001:660:6602:142::10 MQTT     196    Publish Message

Frame 2713: 196 bytes on wire (1568 bits), 196 bytes captured (1568 bits) on interface 0
    Interface id: 0 (eth1)
    Encapsulation type: Ethernet (1)
    Arrival Time: May 19, 2017 10:37:02.888519249 CEST
    [Time shift for this packet: 0.000000000 seconds]
    Epoch Time: 1495183022.888519249 seconds
    [Time delta from previous captured frame: 0.000108173 seconds]
    [Time delta from previous displayed frame: 0.000108173 seconds]
    [Time since reference or first frame: 33.999862504 seconds]
    Frame Number: 2713
    Frame Length: 196 bytes (1568 bits)
    Capture Length: 196 bytes (1568 bits)
    [Frame is marked: False]
    [Frame is ignored: False]
    [Protocols in frame: eth:ethertype:ipv6:tcp:mqtt]
    [Coloring Rule Name: TCP]
    [Coloring Rule String: tcp]
Ethernet II, Src: PcsCompu_4d:e8:0a (08:00:27:4d:e8:0a), Dst: PcsCompu_48:f0:a3 (08:00:27:48:f0:a3)
Internet Protocol Version 6, Src: 2001:660:6602:102::5, Dst: 2001:660:6602:142::10
Transmission Control Protocol, Src Port: 1883, Dst Port: 42260, Seq: 340, Ack: 63, Len: 110
MQ Telemetry Transport Protocol
    Publish Message
        0011 0010 = Header Flags: 0x32 (Publish Message)
        Msg Len: 108
        Topic: topic
        Message Identifier: 4
        Message: xxxxxxxxxxxxxxxxxxxxxxxxxxxxxxxxxxxxxxxxxxxxxxxxxxxxxxxxxxxxxxxxxxxxxxxxxxxxxxxxxxxxxxxxxxxxxxxxx 4

No.     Time           Source                Destination           Protocol Length Info
   2761 34.578423673   2001:660:6602:142::10 2001:660:6602:102::5  MQTT     90     Publish Ack

Frame 2761: 90 bytes on wire (720 bits), 90 bytes captured (720 bits) on interface 0
    Interface id: 0 (eth1)
    Encapsulation type: Ethernet (1)
    Arrival Time: May 19, 2017 10:37:03.467080418 CEST
    [Time shift for this packet: 0.000000000 seconds]
    Epoch Time: 1495183023.467080418 seconds
    [Time delta from previous captured frame: 0.000398671 seconds]
    [Time delta from previous displayed frame: 0.578561169 seconds]
    [Time since reference or first frame: 34.578423673 seconds]
    Frame Number: 2761
    Frame Length: 90 bytes (720 bits)
    Capture Length: 90 bytes (720 bits)
    [Frame is marked: False]
    [Frame is ignored: False]
    [Protocols in frame: eth:ethertype:ipv6:tcp:mqtt]
    [Coloring Rule Name: TCP]
    [Coloring Rule String: tcp]
Ethernet II, Src: PcsCompu_48:f0:a3 (08:00:27:48:f0:a3), Dst: PcsCompu_4d:e8:0a (08:00:27:4d:e8:0a)
Internet Protocol Version 6, Src: 2001:660:6602:142::10, Dst: 2001:660:6602:102::5
Transmission Control Protocol, Src Port: 42260, Dst Port: 1883, Seq: 63, Ack: 450, Len: 4
MQ Telemetry Transport Protocol
    Publish Ack
        0100 0000 = Header Flags: 0x40 (Publish Ack)
        Msg Len: 2
        Message Identifier: 4

No.     Time           Source                Destination           Protocol Length Info
   2762 34.578642107   2001:660:6602:102::5  2001:660:6602:142::10 MQTT     196    Publish Message

Frame 2762: 196 bytes on wire (1568 bits), 196 bytes captured (1568 bits) on interface 0
    Interface id: 0 (eth1)
    Encapsulation type: Ethernet (1)
    Arrival Time: May 19, 2017 10:37:03.467298852 CEST
    [Time shift for this packet: 0.000000000 seconds]
    Epoch Time: 1495183023.467298852 seconds
    [Time delta from previous captured frame: 0.000218434 seconds]
    [Time delta from previous displayed frame: 0.000218434 seconds]
    [Time since reference or first frame: 34.578642107 seconds]
    Frame Number: 2762
    Frame Length: 196 bytes (1568 bits)
    Capture Length: 196 bytes (1568 bits)
    [Frame is marked: False]
    [Frame is ignored: False]
    [Protocols in frame: eth:ethertype:ipv6:tcp:mqtt]
    [Coloring Rule Name: TCP]
    [Coloring Rule String: tcp]
Ethernet II, Src: PcsCompu_4d:e8:0a (08:00:27:4d:e8:0a), Dst: PcsCompu_48:f0:a3 (08:00:27:48:f0:a3)
Internet Protocol Version 6, Src: 2001:660:6602:102::5, Dst: 2001:660:6602:142::10
Transmission Control Protocol, Src Port: 1883, Dst Port: 42260, Seq: 450, Ack: 67, Len: 110
MQ Telemetry Transport Protocol
    Publish Message
        0011 0010 = Header Flags: 0x32 (Publish Message)
        Msg Len: 108
        Topic: topic
        Message Identifier: 5
        Message: xxxxxxxxxxxxxxxxxxxxxxxxxxxxxxxxxxxxxxxxxxxxxxxxxxxxxxxxxxxxxxxxxxxxxxxxxxxxxxxxxxxxxxxxxxxxxxxxx 5

No.     Time           Source                Destination           Protocol Length Info
   2809 35.139027393   2001:660:6602:142::10 2001:660:6602:102::5  MQTT     90     Publish Ack

Frame 2809: 90 bytes on wire (720 bits), 90 bytes captured (720 bits) on interface 0
    Interface id: 0 (eth1)
    Encapsulation type: Ethernet (1)
    Arrival Time: May 19, 2017 10:37:04.027684138 CEST
    [Time shift for this packet: 0.000000000 seconds]
    Epoch Time: 1495183024.027684138 seconds
    [Time delta from previous captured frame: 0.000386003 seconds]
    [Time delta from previous displayed frame: 0.560385286 seconds]
    [Time since reference or first frame: 35.139027393 seconds]
    Frame Number: 2809
    Frame Length: 90 bytes (720 bits)
    Capture Length: 90 bytes (720 bits)
    [Frame is marked: False]
    [Frame is ignored: False]
    [Protocols in frame: eth:ethertype:ipv6:tcp:mqtt]
    [Coloring Rule Name: TCP]
    [Coloring Rule String: tcp]
Ethernet II, Src: PcsCompu_48:f0:a3 (08:00:27:48:f0:a3), Dst: PcsCompu_4d:e8:0a (08:00:27:4d:e8:0a)
Internet Protocol Version 6, Src: 2001:660:6602:142::10, Dst: 2001:660:6602:102::5
Transmission Control Protocol, Src Port: 42260, Dst Port: 1883, Seq: 67, Ack: 560, Len: 4
MQ Telemetry Transport Protocol
    Publish Ack
        0100 0000 = Header Flags: 0x40 (Publish Ack)
        Msg Len: 2
        Message Identifier: 5

No.     Time           Source                Destination           Protocol Length Info
   2810 35.139145437   2001:660:6602:102::5  2001:660:6602:142::10 MQTT     196    Publish Message

Frame 2810: 196 bytes on wire (1568 bits), 196 bytes captured (1568 bits) on interface 0
    Interface id: 0 (eth1)
    Encapsulation type: Ethernet (1)
    Arrival Time: May 19, 2017 10:37:04.027802182 CEST
    [Time shift for this packet: 0.000000000 seconds]
    Epoch Time: 1495183024.027802182 seconds
    [Time delta from previous captured frame: 0.000118044 seconds]
    [Time delta from previous displayed frame: 0.000118044 seconds]
    [Time since reference or first frame: 35.139145437 seconds]
    Frame Number: 2810
    Frame Length: 196 bytes (1568 bits)
    Capture Length: 196 bytes (1568 bits)
    [Frame is marked: False]
    [Frame is ignored: False]
    [Protocols in frame: eth:ethertype:ipv6:tcp:mqtt]
    [Coloring Rule Name: TCP]
    [Coloring Rule String: tcp]
Ethernet II, Src: PcsCompu_4d:e8:0a (08:00:27:4d:e8:0a), Dst: PcsCompu_48:f0:a3 (08:00:27:48:f0:a3)
Internet Protocol Version 6, Src: 2001:660:6602:102::5, Dst: 2001:660:6602:142::10
Transmission Control Protocol, Src Port: 1883, Dst Port: 42260, Seq: 560, Ack: 71, Len: 110
MQ Telemetry Transport Protocol
    Publish Message
        0011 0010 = Header Flags: 0x32 (Publish Message)
        Msg Len: 108
        Topic: topic
        Message Identifier: 6
        Message: xxxxxxxxxxxxxxxxxxxxxxxxxxxxxxxxxxxxxxxxxxxxxxxxxxxxxxxxxxxxxxxxxxxxxxxxxxxxxxxxxxxxxxxxxxxxxxxxx 6

No.     Time           Source                Destination           Protocol Length Info
   2854 35.684907063   2001:660:6602:142::10 2001:660:6602:102::5  MQTT     90     Publish Ack

Frame 2854: 90 bytes on wire (720 bits), 90 bytes captured (720 bits) on interface 0
    Interface id: 0 (eth1)
    Encapsulation type: Ethernet (1)
    Arrival Time: May 19, 2017 10:37:04.573563808 CEST
    [Time shift for this packet: 0.000000000 seconds]
    Epoch Time: 1495183024.573563808 seconds
    [Time delta from previous captured frame: 0.000390437 seconds]
    [Time delta from previous displayed frame: 0.545761626 seconds]
    [Time since reference or first frame: 35.684907063 seconds]
    Frame Number: 2854
    Frame Length: 90 bytes (720 bits)
    Capture Length: 90 bytes (720 bits)
    [Frame is marked: False]
    [Frame is ignored: False]
    [Protocols in frame: eth:ethertype:ipv6:tcp:mqtt]
    [Coloring Rule Name: TCP]
    [Coloring Rule String: tcp]
Ethernet II, Src: PcsCompu_48:f0:a3 (08:00:27:48:f0:a3), Dst: PcsCompu_4d:e8:0a (08:00:27:4d:e8:0a)
Internet Protocol Version 6, Src: 2001:660:6602:142::10, Dst: 2001:660:6602:102::5
Transmission Control Protocol, Src Port: 42260, Dst Port: 1883, Seq: 71, Ack: 670, Len: 4
MQ Telemetry Transport Protocol
    Publish Ack
        0100 0000 = Header Flags: 0x40 (Publish Ack)
        Msg Len: 2
        Message Identifier: 6

No.     Time           Source                Destination           Protocol Length Info
   2855 35.685079463   2001:660:6602:102::5  2001:660:6602:142::10 MQTT     196    Publish Message

Frame 2855: 196 bytes on wire (1568 bits), 196 bytes captured (1568 bits) on interface 0
    Interface id: 0 (eth1)
    Encapsulation type: Ethernet (1)
    Arrival Time: May 19, 2017 10:37:04.573736208 CEST
    [Time shift for this packet: 0.000000000 seconds]
    Epoch Time: 1495183024.573736208 seconds
    [Time delta from previous captured frame: 0.000172400 seconds]
    [Time delta from previous displayed frame: 0.000172400 seconds]
    [Time since reference or first frame: 35.685079463 seconds]
    Frame Number: 2855
    Frame Length: 196 bytes (1568 bits)
    Capture Length: 196 bytes (1568 bits)
    [Frame is marked: False]
    [Frame is ignored: False]
    [Protocols in frame: eth:ethertype:ipv6:tcp:mqtt]
    [Coloring Rule Name: TCP]
    [Coloring Rule String: tcp]
Ethernet II, Src: PcsCompu_4d:e8:0a (08:00:27:4d:e8:0a), Dst: PcsCompu_48:f0:a3 (08:00:27:48:f0:a3)
Internet Protocol Version 6, Src: 2001:660:6602:102::5, Dst: 2001:660:6602:142::10
Transmission Control Protocol, Src Port: 1883, Dst Port: 42260, Seq: 670, Ack: 75, Len: 110
MQ Telemetry Transport Protocol
    Publish Message
        0011 0010 = Header Flags: 0x32 (Publish Message)
        Msg Len: 108
        Topic: topic
        Message Identifier: 7
        Message: xxxxxxxxxxxxxxxxxxxxxxxxxxxxxxxxxxxxxxxxxxxxxxxxxxxxxxxxxxxxxxxxxxxxxxxxxxxxxxxxxxxxxxxxxxxxxxxxx 7

No.     Time           Source                Destination           Protocol Length Info
   2901 36.222876556   2001:660:6602:142::10 2001:660:6602:102::5  MQTT     90     Publish Ack

Frame 2901: 90 bytes on wire (720 bits), 90 bytes captured (720 bits) on interface 0
